<?xml version="1.0" encoding="UTF-8"?>
<!DOCTYPE TestConfig SYSTEM "TestSet.dtd">
<TestConfig>
    <URL>url:rlcp://user:user@127.0.0.1:3000</URL>
    <Method>GENERATE</Method>
    <RLCPRequest>
        <Request>
            <Conditions>
                <ConditionForGenerating>
                    <Input>
                        <!-- generating cond -->
                    </Input>
                </ConditionForGenerating>
            </Conditions>
        </Request>
    </RLCPRequest>
</TestConfig>
