<?xml version="1.0" encoding="UTF-8"?>
<!DOCTYPE TestConfig SYSTEM "TestSet.dtd">
<TestConfig>
    <URL>url:rlcp://user:user@127.0.0.1:3000</URL>
    <Method>CALCULATE</Method>
    <RLCPRequest>
        <Request>
            <Conditions>
                <ConditionForCalculating Time="500">
                    <Input>
			<!-- тест-тест-тест -->
                    </Input>
                </ConditionForCalculating>
            </Conditions>
            <Instructions>
		<!-- тест-тест-тест2 -->
            </Instructions>
            <PreGenerated>
                <Text>
                    <!-- тест-тест-тест2 -->
                </Text>
                <Code>
                    <!-- тест-тест-тест2 -->
                </Code>
                <Instructions>
                    <!-- тест-тест-тест2 -->
                </Instructions>
            </PreGenerated>
        </Request>
    </RLCPRequest>
</TestConfig>
